{
  "paper_id": "temkin_1941_adsorption",
  "namespace": "ScientificMemory.Chemistry.Adsorption.Temkin1941",
  "claim_to_decl": {
    "temkin_1941_adsorption_claim_001": "temkin_theta_eq",
    "temkin_1941_adsorption_claim_002": "temkin_zero_at_inv_pressure",
    "temkin_1941_adsorption_claim_003": "temkin_zero_when_Kp_eq_one",
    "temkin_1941_adsorption_claim_004": "temkin_strict_mono_in_p",
    "temkin_1941_adsorption_claim_005": "temkin_mono_in_p",
    "temkin_1941_adsorption_claim_006": "temkin_strict_mono_in_K",
    "temkin_1941_adsorption_claim_007": "temkin_smul_R",
    "temkin_1941_adsorption_claim_008": "temkin_smul_T",
    "temkin_1941_adsorption_claim_009": "temkin_flip_sign_a",
    "temkin_1941_adsorption_claim_010": "temkin_log_split",
    "temkin_1941_adsorption_claim_011": "temkin_linear_in_log_p",
    "temkin_1941_adsorption_claim_012": "temkin_nonneg_when_Kp_ge_one"
  },
  "target_file": "formal/ScientificMemory/Chemistry/Adsorption/Temkin1941.lean"
}